Jessica H.,"Indianapolis, IN",9/28/2016,5.0,"This is one of my favorite restaurants that I've ever dined at. While in DC, you must check this place out! Plus any/all of their affiliate businesses!The craft cocktails are always made-to-order and very flavorful. My favorite are the mule-inspired drinks. Also, their craft beer selections are unique and there's something for everyone.Everything I've tried here when I've been in town has been fantastic, and I can't wait to go back next time I'm in town! The appetizers are delicious, and the most memorable for me has always been the farmbread. The fig and prosciutto is my favorite, but I'm sure the others are great as well! We've also shared the mussels before, which were delectable.Last time I was in DC, I ordered the sausage and mushroom gnocchi which was AMAZING. I love the sauce and the flavors blend together so well. I like that they serve it with a piece of bread to soak up the sauce. In the past, I have ordered the salmon, and that was very delicious and cooked perfectly. The desserts are also fantastic, with the carrot cake and red velvet cake being my favorites. Finally, the service is always wonderful."
Allyssa B.,"North Ridgeville, OH",8/1/2017,5.0,"Other than the almost hour and a half wait.... (OUR FAULT PLEASE MAKE A RESERVATION!!!!) Everything was unbelievable. The beer was outstanding (some kind of Czech pilsner) the fried green tomatoes were so so good . Mix the sauces, trust me. My husband got salmon prepared with wine, shallots, lemon and butter I believe with whipped potatoes and broccolini which was so so perfect. And I had the tomato soup and three cheese grilled cheese which was the comfort food that I had been craving. Our server was so sweet and helpful and we will definitely try and come back before we head back to Cleveland!"
Paige N.,"Charlottesville, VA",8/10/2017,5.0,"You absolutely must go here, and you absolutely must have a reservation. The food is incredibly fresh, responsibly-sourced, and very delicious. Brunch is fantastic, but other meals are equally good. Their classic breakfast plates are comforting and wholesome, and the menu includes so many other gems like fresh, decadent pastas and some fantastic southern dishes. The service is phenomenal. Caring, knowledgeable, prompt no matter how many tables are full, and charismatic. If you show up here without a reservation, you are crazy. Book a reservation on Open Table so you don't have to wait for 3+ hours in a small waiting area with the rest of the DMV population. Looking forward to my next visit!"
Michael P.,"Ann Arbor, MI",6/8/2017,1.0,"Not all it's cracked up to be. Veggies were not very fresh. Good fried food, of course, but not a lot of places in DC mess that up. Long wait for a table doesn't align with the quality of food/price point. Cocktails are a little weak."
Naimah S.,"Takoma Park, MD",8/10/2017,5.0,The best blueberry pancakes on earth! This is my go to breakfast spot. I also get the apple chicken sausage and peach bellini. I highly recommend Founding Farmers.
Danielle C.,"Snoqualmie, WA",4/28/2017,5.0,Went with some friends and enjoyed our time here. I ordered the ahi salad and loved it! My friends dishes were flavorful and detailed too. You can tell they put pride in the menu and make sure to offer the best to guests- we were impressed. I will be visiting this place next time I am in town!
Melissa L.,"Washington, DC",9/14/2017,4.0,"yum! nice place, fresh and local food."
Sophia H.,"Washington, DC",11/9/2016,3.0,"Ugh I wish I could like this place, but the food just didn't impress me. This restaurant is just over-rated for me. I came here twice for brunch -- 1st time, I got the sausage, mushroom, & spinach pan scramble, and 2nd time, two-eggs breakfast (with chicken-apple sausage). Both dishes were pretty good but very standard. The chicken-apple sausage was tasty and better than average though. One of my friends got the chicken and waffles, and she said it was possibly the best she's ever had. I tried a bite of her dish - again, I thought it was just pretty good. IMO, go to Miss Shirley's Cafe (in Baltimore or Annapolis) for the BEST chicken and waffles ever. Okay food but very nice service."
Tiffany D.,"San Francisco, CA",3/18/2016,5.0,"Why is this place so popular? It makes it unbearable to wait for it.  The anticipation to dine is anxiety being built up and (hard to admit) worth it!Their brunch is slam dunk and a classic American kind of dining!  It's soulfully fulfilling!  I love their fried tomatoes!  It's a perfect crisp and the dips to it, is a moment on the lips and forever on the hips kind of ordeal.  Bar is straight up there.  Great for mimosas and Bloody Mary for the daytime.  Evenings - time to get your drinks on!  They have American entrees for dinner as well.  Well deserving of the name, Founding Farmers.  Perfect title and cuisine for Washington, DC!  It's one of those spots where you have to visit when in DC!"
Marilisa S.,"Cary, NC",9/5/2017,1.0,"Very disappointed. I was expecting great food and decent service. We had reservations and still had to wait 30 minutes. Food was okay, not worth the wait. And the service was extremely lacking. We had a party of 6 and one member of my party didn't get his food until the rest of us were done with our meal and that was only after we asked 3 different people where his food was. When his food was finally brought out it was plopped on the table and no apology or acknowledgement of the delay. Also if you sit upstairs I recommend bringing a jacket as it was uncomfortably cold. I would not recommend nor would I go back."
Elle E J.,"Huntsville, AL",10/16/2016,5.0,"I'm always hesitant when a seemingly trendy place has great reviews. Do other reviewers actually love the food or do they just love what they're supposed to love because it's the hot spot?The former. Woah. Blown away. Let me start by listing everything my dinner mate and I ordered and devoured: 2 signature cocktails, 3 burger sliders (with fries) as an appetizer, chicken and waffles with mac n cheese and mint watermelon, and goat cheese and butternut squash ravioli with chicken cutlet and [incredible] bread, and 2 giant pieces of cake. All of that was only $88. For the quality of food and the experience, we were expecting a lot more. The flavors were perfectly paired on every dish and everything tasted so fresh. How can something be so rich and flavorful yet so light and not overwhelming? The cocktails were incredible. They were strong enough to give us a slight buzz but not overpoweringly liquored up. I got the Fall seasonal 'Carlisle' and I've never quite had anything like it. Very drinkable. We were pretty full by the end of dinner so we got the cake to go. GET THE CAKE TO GO. So moist. So yummy. The carrot cake's cream cheese icing almost had a hint of coffee in it...The vibe and ambiance were welcoming while also feeling luxurious. You must use the restroom while there. Yeah, that's strange, but it's cool -- cherry blossom wall paper and farmhouse sink. The fabulous service sealed the deal for 5.5 stars. Knowledgeable, friendly, inviting, and seemingly genuinely happy to be there."
Jessica L.,"Baltimore, MD",4/5/2016,4.0,"Overall lots of excellent veggie options!Also apparently they don't make ""mocktails"", really? So I ended up ordering the Rickey soda which was excellent, Limey, and delicious.Everyone raves about the fried green tomatoes but I would say they are just good,not amazing, the dipping sauces were excellent tho! Can share among 2-3 people.I loved the meatless section of the menu. I adored their cranberry and Brie veggie burger. It had a really smooth but rich texture which was so filling and tasty. Came with an arugula salad that was just ok.For dessert highly recommend the beignets. They sometimes take up to 20 mins to make but ours came out super fast. 6 huge beignets we shared among 3 adults with 3 dipping sauces. So satisfying. Can't wait to come back. Reservations a must."
Johanna B.,"Washington, DC",8/14/2017,2.0,SOOOO OVERHYPED! The wait is so long even if you have a reservation and the food is not at all worth the price.
Marc O.,"Bridge City, LA",7/30/2017,5.0,"Went on a Sunday at lunch and had to wait for about an hour for a table. But glad we did, the service was great and food amazing. Everything is made from scratch. We loved the chips and breads. My wife had the shrimp, daughter had the fish and chips. My boy had the goat cheese burger, and I had the flank steak. Also the family shared a huge huge slice of carrot cake. I highly recommend this place if your in the DC area."
Rashaad W.,"Washington, DC",5/23/2017,4.0,"My my my my- this place is AMAZING.  Went here for the first time over the weekend and can't put into words how great the food was. I had the pot roast with garlic blackened pepper wings.  The pot roast was savory and over mash potatoes- well seasoned and savory.  The garlic blackened pepper wings are finger licking good and tasty.  The only thing I did not like was the cornbread, although it was good- it appeared to be uncooked."
Peri Elizabeth M.,"Miami, FL",5/7/2016,5.0,"This was by far, the best brunch experience I've ever had! Everything was made from scratch- and I mean everything! The orange juice is a must try! We saw everyone at the bar ordering a Bloody Mary so I wanted to try it, it was very good if you like them spicy. The waitress was very attentive and the ambiance was great! It also helps that there were 50 people waiting and we got two seats at the bar right away :) If I could give this more than 5 starts I would!"
Quinlyn S.,"Kensington, MD",8/8/2017,3.0,I have been to founding farmers many times and at all locations. There good is always amazing--especially the appetizers and pastas. There is something on the menu for everyone. However my service is almost always slow and subpar.
Paige A.,"Wesson, MS",6/13/2017,4.0,"I went in expecting mind blowing, but came away with a good meal. The lemonade was really great and the kettle corn made for a fun treat before the main meal. The atmosphere was nice in a Sunday afternoon.We had the Ribeye, Tomato Soup & Grilled Cheese, Cheeseburger, and the Fish of the Day With the Meunière."
Miriam G.,"Northwest Washington, Washington, DC",8/13/2017,3.0,"Honestly, this place has a lot of hype, and I was definitely let down. The food is decent but nothing too out of the ordinary or high quality, and the eggs benedict was pretty salty. The fruit was not fresh or good quality, and seemed like a fruit salad from Safeway, to be honest. The best part of the meal was the English muffin, which was homemade and really tasty.The ambiance is nice, and the service is good, but for the price, you can definitely get better food elsewhere."
Derek L.,"Boston, MA",4/23/2016,4.0,"Founding farmers. The wait here is exceptionally long for 9pm dinner. Try to get here early or make a reservation. I ended up sitting at the bar.The setting is dimly lit and a bit classy. Service was great and the food was delicious.I had the fried green tomatoes for an app. The chicken pot pie (which they use a biscuit instead of a crust) and carrot cake with ice cream for dessert. Overall, I enjoyed the meal. I think the food is reasonably priced for the setting and the experience is quite nice."
Bre Y.,"Washington, DC",11/2/2016,5.0,"A guaranteed great meal of all times of the day and great customer service! It's always busy considering the high quality of food and reasonable prices. I have been several times but love their breakfast, the stuffed French toast, the chicken and waffles, the eggs (actually seasoned unlike other places), the chicken sausage, the everythangg! There's a variety of fresh sauces for the bread that comes with the meals. Be sure to ask what type of jams they have for the day, it often changes. The Beignets are a must try. I love the variety of sauces that come with them as well. They are perfectly crispy and smothered with powdered sugar!Although I'm obsessed with their breakfast, I'm looking forward to returning very soon to try their dinner menu!"
Misty M.,"Washington, DC",7/29/2017,3.0,"I like the food here, but the service is generally lacking.  Overall, the place seems to be over-hyped; there are plenty of better restaurants nearby.  I generally only come here when I am invited or when I have folks from out town that have requested it."
Katie H.,"Washington, DC",11/1/2016,3.0,"I was really excited to try this restaurant, as I had heard good reviews, but it didn't live up to my expectations. We had a reservation but still had to wait, and the place was really crowded (people clogging up the entry-way, etc). The food was pretty decent, but nothing spectacular. We shared the corn bread to start which was alright, and then I followed with the Scallop risotto, which I enjoyed. Overall, i don't think this place quite lives us to its hype, but it's a decent lunch place."
Earl W.,"Southwest Washington, Washington, DC",8/7/2017,1.0,I brought my grandmother here for her birthday she ordered the crab cakes and I ordered the Salman our food was awful my grandmother didn't like the crab cakes but she ate them because she didn't want to waste my money and I paid $90 plus a $15 tip but as long as I took my grandma out it's cool
Cecilia B.,"Seattle, WA",8/7/2017,4.0,"On my visit here, I tried the french press coffee, over easy eggs, pork sausage, side breakfast salad, hash browns, and the poached egg pastrami hash. The pastrami hash was delicious and the hollandaise sauce was the best part of the meal. The best hollandaise sauce I have ever had. The eggs, sausage, salad, and hash browns were extremely average and I would not order them again. The worst part of the meal was the french press coffee, which was surprisingly terrible. It was very, very silty and was hard to drink due to all the residue in the bottom of the cup. If I went back for a second visit, I would make sure to have coffee at home before I go so I don't have to get any there. I would absolutely recommend anything with the hollandaise sauce, though."
Marika C.,"Virginia Beach, VA",11/18/2016,4.0,"I came here last Saturday for my boyfriend and I's 5 year anniversary. We can here for dinner and the wait was about 30-45 minutes long. We tried to come back on 30 minutes but were a little late and they had already called our names, but they still sat us which was nice. The place was packed. We sat at one end of a table and there was another couple on the other end. (So there was one seat in between us.)I ordered the rotisserie chicken and my boyfriend ordered the chicken and waffles. I also got the lemon lime craft soda. Okay, so the craft soda was so good!! It was like the best so I'd ever had.My rotisserie chicken was salted perfectly - the skin was good. When I first got the plate and saw that I only had 3 potatoes I thought it wouldn't be enough, but it was. The side vegetables I got were cold, which I was disappointed in because I thought they would have been warm. My boyfriend's fried chicken was good. He liked it a lot, I however found the taste to remind of a TV dinner chicken, but he said I was wrong lol. His waffles were so good. I'm anti-waffles, but I couldn't stop eating it and the syrup was so good. My boyfriend loves mac&cheese and he really liked the one we had here. I brought back some of the waffle and the Mac&schemers to my mom and she even was like, ""this is really good.""We will definitely be back! And probably with a reservation this time, ha"
Whitney P.,"Manhattan, NY",11/26/2016,5.0,"We were visiting D.C. for the Thanksgiving holiday and came here for our Thanksgiving meal. I didn't make reservations early enough, but lucked out and were seated right away when we walked in. There was a fixed menu of traditional Thanksgiving food. We didn't know anything about the menu before hand, so I was super excited about that! Everything was delicious and truly tasted like a home-cooked Thanksgiving meal. I look forward to trying Founding Farmer's everyday menu next time we visit."
Jack B.,"Northwest Washington, Washington, DC",5/8/2017,2.0,"I got the humongous buffet @ brunch.  Too many choices...avoid too much bread/waffles except with the fried chicken/pancakes There are  2 types of fried chicken, prime rib/ sides/salad varietals and save room for dessert. Having said that, the service, while amiable, sucked. Coffee took forever to get there (and we were 15 feet from the urn). I was the only buffet-goer so each of the other 5 diners ordered off the menu. Ranged from superb (crab cakes) to meh? A ""snapper"" in a limpid, flavorless sauce. They brought around Ala carte appetizers but it did not compensate for the sl-------oow service. Price-wise the buffet is an average cost but the entrees were top-of-the market (the crab cakes were very pricey). Watch where you are seated so that you are not blinded by the southern sun. If I go back it will mainly be to try their ""craft"" liquors, the Rye in particular."
Laura G.,"Stevenson Ranch, CA",9/17/2016,4.0,"To be candid, this restaurant kept popping up in my search for great places to eat but the menu is full of comfort food - not really my ideal.  After a few friends that knew we were in DC told us we had to go we biked here from the Capital Building.  The ambiance was warm, inviting and homey.  We were there for a late lunch and knowing we had a dinner in the not too distant future we ate light.  We started with the traditional deviled eggs.  NOTE TO SELF:  Onion in deviled eggs is delicious.  My husband wanted to try the sandwich with mushrooms, cheese on a grilled bread - highly recommended by our waitress.  We share it and it was without a doubt D E L I C I O U S.   So damn good.  The girl next to us was raving about the red velvet cake - said it was the best in the word - bold statement....We will have to go back to try it.  I'm not a comfort food type of gal - but this restaurant could change that....."
Lauren H.,"Provo, UT",5/20/2017,4.0,"I feel like this restaurant is a little over-hyped. We went at 3 in the afternoon and there was still a 30 minute wait, so it's just packed all the time. That being said, we had a lovely meal. We started with the fried green tomatoes. I don't even like tomatoes and I thought these were great. We asked for some ranch sauce because we don't love goat cheese or Greek goddess dressing which it was it came with. Their homemade ranch is delicious. We also got the pot roast which was quite good. The blend of flavors of the roast, onions, mashed potatoes, and beans was awesome. We also got the butternut squash mascarpone ravioli and that was really bland. I couldn't finish it because there was no flavor to it at all. However, our server, Kathryn, was so nice and made the entire experience really great. She made us feel very welcome!"
Tamiko W.,"Charlotte, NC",7/10/2017,5.0,"Oh my gosh! This place is phenomenal.  My boyfriend and I visited Founding Farmers over the 4th of July weekend for lunch before heading to the National Mall for the day. We didn't make reservations, which was probably the first mistake, but luckily, we found a spot at the bar within 15 mins. Otherwise, we were looking at a 1 hour and 15 min wait. For the appetizer, we had the cornbread. It came in a mini skillet (super cute) and really good; not too dry, not too sweet. For our meals, I had the chicken pot pie and my boyfriend had the fish and chips. The chicken pot pie was the BEST pot pie I've had in ages. The breading was delicious and the chunks were a decent size. Usually, pot pie doesn't fill me up, but I could only eat about half of this serving. I also tried the fish and chips meal and it was just as great! The service was also wonderful. Our server/bartender was super nice and very quick with putting in orders and getting us everything we needed. I wish I lived in DC. This would definitely be a regular spot for me. We'll definitely be back again when we're in DC visiting family."
Naomi G.,"Washington, DC",4/13/2017,2.0,"Went for lunch. Our waitress was great. Chicken salad delicious. Lemon lime soda so refreshing. ordered a cheeseburger medium well. It came out oozing blood. Mind you I like my steak that way but not my burgers. I asked them to throw it back on but they instead gave me a brand new one. Props for that. However, a burger takes a minute to cook. So I sat waiting for awhile and ate some of BFs salad. Ok not the worst problem...but how an American restaurant messes up a burger is baffling.What is really bad is that when we were getting ready to go, bf very politely asked a waitress walking by if we could get our check (because ours was in the weeds).  She said abruptly with a scowl ""I'm not your waitress but I can ask her to get your check."" I was like woooooow rude much?? We know you aren't the waitress. Come on. Customer service sucks these days. Annnyywway - just like that, we aren't coming back. I coulda forgiven the burger miss. And BF works right at the IMF. Business lost. Boom."
Sam B.,"Philadelphia, PA",12/7/2016,5.0,"AMAZING. My friends and I came for brunch this weekend and as expected, the wait was 1.5 hours. Which was completely fine because we wanted to explore anyway and it gave us time to walk by the White House and National Christmas tree. Once our names were called we were promptly seated upstairs- so nice and cozy!The food was amazing and the service was fast. We got cornbread, beignets, chicken and waffles, sausage and gravy eggs benedict with hash, and bacon. Everything is made in house and delicious. I'm not even sure what my favorite dish was but everyone felt the same way- we loved it all! The portions are large and the price is very reasonable for brunch! Can't wait to go back and try more things on the menu. Honestly we didn't even get drinks for brunch so that we could use all our calories toward food."
Jeff W.,"Alexandria, VA",8/6/2017,5.0,"Love this place!  We had reservations for 12 for my wife's birthday dinner. Sat us quickly on a Saturday! Our service was awesome!  Our server was fun, helpful and interacted with all of us.  Wanted to make our night special.  The food? Whoa!  So good! Drinks were great!  They even accommodated having a special cake delivered and made fridge available for the cake, which was large.  This place is just awesome. Great food! Highly recommend!"
Adey P.,"Washington, DC",8/11/2017,5.0,One of my favorite restaurants that I can always count on for a great meal and great dining experience.  Reservations recommended. Always outstanding service. A brunch favorite!
Melissa M.,"Brooklyn, NY",3/14/2016,5.0,"If you haven't heard of Founding Farmers, have you even heard of Washington DC? Any trip to our nation's capital must include a visit to this food capital. I'm pretty sure this is the founding father of the recent farm to table movement. These type of restaurants are popping up everywhere. They already form a food nation, but should pay respect, give credit to and celebrate their culinary papa, Founding Farmers, with a holiday. The first time I visited five years ago, I ordered French toast.  I normally don't like French toast, but there something about the look of the plate passing by caught my eye. Glad I got a glimpse because I wanted to toss my eggs in the air in syrupy carb bliss! This past trip, I went with the lunch fare. We started off with Devil-ish eggs. Poke me with a pitch fork, they were worthy of that name. Roast me, toast me or burn me in the pit, as long as I get some of those eggs!For my main, I ordered the turkey, gruyere and honey mustard sandwich. The bread alone would've earned five stars. The turkey was Thanksgiving level caliber and I wanted to shake the farmer's hand and learn the 's name. The fries on the side didn't get as much attention from me because my stomach was filled with the life cycle of a bird, but they were delicious as well. All that to say, eat here or you didn't really eat in DC."
Tina L.,"Chicago, IL",3/7/2016,5.0,"This was probably my favorite meal in DC. I absolutely LOVED all our dishes that we ordered! We were there in time for both the breakfast and lunch menu. AWESOME SAUCE! Here's a blurb from their website:""The food prepared in our Founding Farmers kitchens is made in-house, from scratch every day. Our dedication to serving high-quality, real, farm-to-table food is what sets us apart. We bake our own bread (approximately 118,000 loaves per year), we grind our own beef, we press our own juices, we even churn our own butter. Our purveyors are carefully chosen and measured against our high standards.Our menus are inspired by our country's rich culinary tradition, including our versions of all-American classics, as well as innovative creations based on a wide range of American cuisine.Simply put, it's real food & drink.  All served with pride.""I highly recommend trying the shrimp and grits (with andouille), the skillet cornbread (AMAZINGLY soft and moist) and the fried green tomatoes. Just so you know...the next time I come to DC, I'm coming here for a meal for sure.From the breakfast menu, we ordered ""From the Range"" and got the ranch steak & eggs (scrambled) which comes with leek hash browns, tomatoes, and your choice of bread. We got the English muffin, which was great with jam.The skillet cornbread is served with sea salted honey butter. So...as I mentioned above, the cornbread was so good by itself. But with the sea salted honey butter, I was in HEAVEN.The shrimp and grits were prepared well: the grits weren't too runny or mushy, it was the perfect texture. And the shrimp was cooked to perfection as well. I kept going in for more bites even though I was so full.Stay hungry, my friends!"
