Alyssa B.,"Washington, DC",9/20/2016,4.0,"I've been going to Founding Farmers since I was a freshman in college at GW.  It's a tad bit overrated and has its ups and downs, but all in all, it's a good restaurant.  I went there last week for one of my FF favorites: the fried chicken with waffles, mac and cheese, and a crop list side (I always get green beans).  The chicken had amazing flavor injected into the meat and in the breading itself, which was perfectly crisp without being oily or heavy.  But sadly, the chicken was dry and overcooked.  The mac and cheese was delicious, as always.  The waffles were delightfully light and fluffy.  The green beans were fine, but slightly overcooked and oversalted.  A solid 4 star meal-- good food with some execution problems. The service was good, but a bit rushed, per usual, since they're always so busy.  Not worth the hype, but still worth a visit for sure.  I've been here at least a dozen times in the past 7 years and have always had a fairly good meal.  Their biggest flaw is that they can be inconsistent depending on the day and the dish.  I've definitely had some meals here that were closer to 3 star quality.  Fried chicken is generally a safe bet though.  It's one of their most popular dishes for a reason!"
Alfred C.,"Austin, TX",9/11/2017,1.0,Under cooked outer layer of my NY Steak while the inner is over cooked; sautéed spinach is burnt every other bite. Save your time and go to the one in McLean guys! Nice staff tho
David S.,"Irvine, CA",8/27/2017,4.0,"This was a great restaurant, very crowded but we got in as we had a reservation. All the food that we ordered were hearty and filling. We loved our experience here in next time we are in DC will definitely be there again."
Kacy G.,"Indianapolis, IN",7/3/2017,5.0,"I knew I would like FF when I read the restaurant description and their commitment to supporting local farms and using the best ingredients possible.  We were waiting outside on the street before they opened, and probably 40 people had congregated by the time the doors opened!  Fortunately, we were seated right away.  I had an ordering panic moment.  My friend ordered the hangover hash which I planned on getting.  I have a pretty strict rule about never ordering the same thing as my dining partner---I want to try more things!  So, I made a last minute decision and got the traditional eggs Benedict.  I had a hint of orderers remorse initially, but that was wasted worry as it was so well executed.  Nothing like a well done classic!  My friend's hangover was great as well.  Our server, Hayli, was so kind and very helpful with info about the city.  Overall great experience."
Catherine S.,"Honolulu, HI",9/1/2017,3.0,"This place is a little overrated. I waited 1.5 hours only to find out they forgot to put our names down. Thank goodness one of the host remembered my face and gave us the next available table.  Waffle chicken was alright, have had better ones. The beignets were definitely my favorite on the menu!!!"
Thy N.,"Norfolk, VA",8/8/2017,5.0,"My husband and I went to brunch here, and it was FABULOUS.  Be prepared to wait though.  He and I arrived around 10:00 am, and it was an hour wait for a table for 2.  I'd recommend making reservations in advance. We found two open seats at the bar almost immediately though, so that may be an option for you. The bar service was great.  She was very attentive, but not overbearing.  Water, drinks, and coffee were refilled quickly.  It was a bit cramped at the bar, but only because the plates/portions were fairly hearty.  I got the crab benedict, and he got the chicken and waffles.  Both were cooked and prepared perfectly.  We also got a plate of the beignets, and they were divine.  There were six very large beignets with three different dipping sauces - raspberry, caramel, and chocolate. I've been here several times for breakfast and dinner, and I have never been disappointed."
Troy S.,"San Diego, CA",6/21/2017,5.0,"Loved this place!   Great food, great service, and a great story.  The food is farm to table and everything was delicious!  Chicken and waffles...wow!  I also had the Shrimp & Grits with Andouille...simply perfect.   I'm going to have to book another trip back east to enjoy some of their other dishes.  Their story is cool too...owned by the North Dakota Farmer's Union (about 47,000 members) who wanted to take people back to the source, to the foods that are grown, raised, and harvested on American family farms.  This is American allegiance and no better place to represent than in DC.  I just happen to be from ND too...they made me proud!"
Melissa S.,"Manhattan, NY",6/23/2017,4.0,I went here years ago but never got around to doing a review. This place is a thing and I highly recommend a reservation even if say you're doing an early breakfast mid-week - still make a res. I had some type of stuffed pancake/waffle thing with red velvet where I don't remember details but do remember it being delicious. Check out this place and come here to celebrate America through food.
Ashley A.,"Las Vegas, NV",4/30/2017,5.0,Yes the hype was worth it and yes you should go. If you want to do brunch make sure you have made a reservation a couple of days in advance. My only gripes are that the hostesses were kinda snotty and they ran out of the Brie flat bread. I think founding farmers needs to hire a couple more people to wrangle all the people
Linda F.,"Worcester, MA",4/10/2017,4.0,"This was our first visit to this restaurant and I can honestly say that everything about eating at Founding Farmer's is great. Our server was prompt and attentive, and the food was spectacular. We started with sharing the Devil-ish Eggs: Classic. There is a seafood combo version as well but we weren't in the mood for it. The eggs were as described - the classic deviled eggs taste and texture. I ordered the Yankee pot roast and my husband got the Fish of the Day rock fish cooked à la meunière, which is butter, shallots, garlic, and lemon. Both dishes were flavorful and cooked perfectly. We finished off our meal with a slice of carrot cake and a slice of chocolate mousse cake, both served with vanilla bean ice cream. The portions met or exceeded my expectation. Be warned that the desserts are very big and can be shared with another person. We ended up taking home half a slice of each cake + I had some leftover pot roast and mashed potatoes. The only thing that deducts from FF being a 5-star experience is the lack of a comfortable waiting area. We had a 5pm Saturday reservation and the place was already packed to the walls in the small waiting area with people waiting out in the street. It wasn't the best introduction to restaurant, but the rest of the experience makes up for it."
Hugh M.,"Halifax, Canada",3/19/2017,5.0,"Sometimes I only come to DC for a meal here. This time is one of those. I'm on my way to Atlanta, and pulled in to get brunch. This place is the single busiest place to eat brunch on or near the national mall. Do yourself a favour, eat here, but get a reservation. The best brunch food EVER!"
Meleah S.,"Charlotte, NC",9/15/2016,5.0,"Oh. My. Goodness. I have so many great things to say. We ate here on a recent trip to DC and both agree that we will make it a permanent stop every time we visit. We made a reservation and still had to wait 20 min for a table (although those without a reservation had an hour and a half wait). We ordered drinks (which were great), a flatbread appetizer (also good but we both agreed that the meals were so filling that we would skip the flatbread next time), chicken and waffles for him (he absolutely loved it), and chicken bolognese for me (I cleaned my plate). We had no room for dessert because we were so full. Prices were okay. Not cheap but not super crazy expensive. Service was good. No one was rude but no one was super friendly (at least by my raised-in-the-south friendliness standards). Definitely recommend this place!"
Victor L.,"Virginia Square, Arlington, VA",8/6/2017,5.0,"Didn't notice how popular this place was before coming in for lunch today. Wait was over an hour (party of 4) even though Google Maps indicated ""less busy than usual"" for a Sunday afternoon. Food was well worth the wait."
Olga S.,"Clayton, NC",7/4/2017,4.0,"This place seem to be the only one that now matters for brunch in the neighborhood. Especially on Sunday. The wait was literally up to two hours and waiting room was as overcrowded as public transportation in Russia during Soviet era. I had gotten from being hungry to fatigued and ""hangry"". People stopped exchanging pleasantries and were avoiding eye contact. America stopped being America. Over waffles and eggs, people. One question? Was it worth the wait? Well you decide. Food was fine. The eggs from pasture raised chickens tasted just as delicious as ones from the caged ones. Chicken sausage was juicy and ciabatta toast charred and delightful. I also was able to taste a waffle and one huge blueberry pancake from my son's plate. I tasted this before. It was just good. Not more than that. Restrooms need baby changing table. Service was good. In general nothing to write home about. Next time I ask going to the empty hotel restaurant across the street. I ll just ask them not to tell me how they raised their chickens."
Chelsea A.,"Cincinnati, OH",10/16/2016,5.0,"YASSSS!!! This spot is a DC fav for obvious reasons (i.e. their relationship with local farmers & their delicious food). When my birthday rolled around, there was no question about where I wanted to go. After a frustrating trip on the metro, I was sooooo ready for a cocktail. I decided to be a bit adventurous and go with a custom cocktail from the bartender. I was presented with a delicious gin drink with almond liquor and citrus called ""The Elizabeth."" The only downside was the price. At $15, I think I'll stick to a glass of wine in the future. We also ordered the bbq nuts for snacking. They were mixed with golden currants for a bit of sweetness. Yum!For dinner, I really couldn't decide what to order because the menu is so large and everything sounded great! Fortunately we had THE best waiter ever, Jason (I think). He was fantastic and went over everything on the menu with us. When I say ""the best"", I mean I want to be his friend so we can go on culinary adventures together and he can curate all our meals. The way he described the dishes made my mouth water! I ended up ordering the plank salmon, which was superb! I wish I was a bit more adventurous with my sides, but was mostly satisfied with the mashed potatoes and green beans. For dessert (it was my birthday, of course I had to get dessert!) I ordered the red velvet cake with strawberry ice cream. It came complete with a birthday candle :)"
Stefanie C.,"San Francisco, CA",9/4/2016,4.0,"Apparently, this is a popular place to eat in DC. It came highly recommended by many friends, even one who lives in DC, so I decided to meet up with her here. She made reservations, which is a must for Founding Farmers.We were seated when our whole party arrived, and I still chuckle (yes, I said chuckle) at the brand new waiter that we got. A friend who I was traveling with was essentially interrogating the waiter about why there were two menus with so much overlap, and the waiter eventually caved in and apologized for being new there. Poor guy!As for the food, I started with a Bloody Mary, which was tasty! Sufficiently spicy to my liking. We also started with Uncle Buck's Beignets. They were giant and came with a few different dipping sauces. These weren't particularly unique but still good.For my entrée, I ordered the Beef Pastrami Hash. Delicious! Loved the fresh ingredients and mix of flavors. Mine came on an English muffin with a poached egg. Would definitely recommend this. My friend got the Fresh Strawberries & Cream Stuffed French Toast. I wasn't too impressed by this, but maybe Founding Farmers just isn't known for their French Toast.Overall I had a great experience here! I wouldn't say it's a MUST in DC, but you won't regret coming here, especially if you're a fan of restaurants with locally-made and fresh ingredients."
June J.,"Hampton, VA",9/4/2017,5.0,"Food was great! Went for brunch and had beignets, grits, and bacon. Grits were amazing! No kids menu but lots of options for little ones. Only drawback is that drinks are pricey. And no refills on an Arnold Palmer? Overall, I would eat here again."
Vanessa H.,"Falls Church, VA",7/13/2017,5.0,"Came to this exact location twice in the past year, once for mid-day lunch and the other for a late night dinner. Sitting on the first floor is great, but I found the top floor to be much better and more intimate due to the bar chatter you can hear across the way. The food was elegant and presented well. I had the salmon, and the appetizer was an ample portion too. I look forward to trying out the Tysons Corner location to see how it compares with this one."
Sam K.,"Fort Lauderdale, FL",9/2/2016,5.0,"YES! By far the best stop of my trip. 8,300+ mostly good reviews is nothing to trifle with. This farm to table concept restaurant has the best quality/dollar-sign ratio ever. Who can argue with farm fresh ingredients for a price not much higher than a night out at Chile's?We were seated upstairs with a table near the window looking out onto the city street. The decor is really welcoming and stylish. It reminded me of S3 in Fort Lauderdale for those who are familiar with South Florida. (Sorry if that reference doesn't help you, but you have thousands of other reviews to look at.)If I had one piece of advice, do not leave without trying the cornbread! It was the best home-made style cornbread that I have had. It is filled with corn kernels and the contains the perfect texture paired with a savory and mildly sweet flavor.I am always tempted to get some kind of beef related entree when at this type of restaurant. I ordered the rib-eye, which was surprisingly well priced, with a side of salted mint watermelon and pearl pasta. Of course, I had my steak medium rare. When they brought it out, it was definitely more on the rare side, but I was feeling adventurous so I didn't mind. It was one of the best steaks that I have had. I have had a LOT of steaks... Seasoned minimally and perfectly. The watermelon really complimented the steak in a way that is difficult to describe. The pearl pasta had it's own unique blend of flavors and ingredients that was truly mouth watering.For dessert, a simple scoop of vanilla ice cream. It doesn't hurt that they make it in house from scratch! However, I don't have much to say about this dish other than that it was very good. Service was good. Our waiter could have been slightly more attentive, but it was extremely busy, so I understand why he may not have been.  Also, I am not sure why they partnered with farms in the Midwest instead of more responsibly sourced local farms. I am sure that they have a good reason. But, sourcing from so far away is a part of the problem that this concept of restaurant is advertising that it is not contributing to."
Alex C.,"Miami, FL",8/5/2017,4.0,Great food and great service at hipster restaurant near Georgetown. The service earned 5 stars. Although there were a dozen plus people waiting they honored our reservation within 5 minutes of our arrival. Our server Marc was super friendly and offered up some excellent recommendations from the menu which we tried. The crab and corn dip was as Delicious as it was unique. Served with jalapeño garnish and crusty bread it was a hit at our table for 4. We enjoyed the Arctic char Menuiere and the short rib. The food was served in a timely manner and piping hot. We will return.
Shana R.,"Bayside, Queens, NY",8/28/2017,5.0,This was our first trip here! This restaurant is farm to table. We started with a pesto flatbread which was delicious- the bread was so fresh as well as other ingredients. We had the wings which my children enjoyed! I had the cedar plank salmon which was fresh and yummy! My husband and fried chicken with waffles and came with a side of Mac and cheese. The portions were generous and reasonably priced. For desert we had yummy cookies and ice cream. Highly recommend this restaurant. Family friendly! Amazing food!
Riley B.,"Lehi, UT",6/30/2017,5.0,We were visiting family in DC and this was recommended by so many people for a great reason. Everything we had was incredibly delicious. We wish we could have ordered more. The cheese and meat plate was our favorite.
Geena F.,"Nashville, TN",6/30/2017,3.0,"First time I went here it was awesome! Food was yummy and the people were amazing!  This time when I went the food was just ok.  Don't get me wrong, it was a good meal, but not one that blew me away.  The people were still incredibly nice though!  It's definitely a place you must go to if it's your first time in DC."
Talisha R.,"Upper Marlboro, MD",10/25/2016,4.0,"I've been to Founding Farmers on many occasions and I'm surprised that I'm just now getting around to leaving a review. The food is pretty good and will leave you satisfied I've had many dishes her from the chickens and waffles to chicken salad sandwich,  everything has been really good. I would say that for large groups that the service goes down one notch. I've been two times with my coworkers and it was numerous times on both occasions that we had to send food back or request the food to be reheated.I will continue to go but I may check out another location but this one is close to my job so it very convenient for lunch."
Jared H.,"Takoma Park, MD",8/28/2017,4.0,"The food is good - especially for breakfast. A good place to bring parents or donors or business clients for a relaxed meal that still has a wow factor but with stick-to-your-ribs comfort food. 'Nuvelle Country Comfort' or ""a super fancy cracker barrell"" Save room for fresh donuts!"
Jeanne T.,"Yardley, PA",8/24/2017,5.0,Visited on a weekday morning in late August. Service was quick and great. We ordered one whipped blueberry pancake and the crab meat eggs Benedict. Both were really delicious and highly recommend!
Vicki N.,"Duluth, GA",3/13/2017,4.0,"I've heard rave reviews about this restaurant, so we definitely had to make a reservation to try it out. Our reservation was at 6:30pm on a Saturday night. When we walked in, it was extremely packed. People were everywhere. They were running slightly behind, so we weren't seated until maybe 6:40-6:45pm.Our table shared multiple dishes:1. Skillet Cornbread- This cornbread was moist and sweet with bits of corn in it. I love sweet cornbread. It also comes with a side of butter+honey mixed together. Definitely slather that onto it.2. Brie Farm Bread- This particular Farm Bread comes topped with brie, green apple and onion jam. I was a huge fan of this. I love sweet and savory combinations.3. Boneless Ribeye- We ordered this and requested their Mexican corn as a side along with the Maple Bacon Brussel Sprouts. The sides were amazing!! I'm a huge fan of Mexican corn. It comes topped with mayo, cotjia cheese and paprika. So good! The Ribeye, however, was not as good as I thought it would be. The quality of the meat was not that great considering it's a nicer restaurant. Also, the meat was seasoned with something odd, not just salt and pepper. I couldn't exactly figure out what it tasted like, but I was not a fan of it. We asked for medium rare, but we ended up receiving medium-medium well. I would not order the Ribeye again.Btw- The Mexican corn was not on the menu as a side. The waiter stated that the corn comes with specific dishes, but we requested it as a replacement side, and the waiter was able to accommodate.Our waiter was nice and attentive. Someone in my group wasn't happy with the taste of her drink, and he was happy to switch it out for us.  Also, if you're looking for a nonalcoholic beverage, definitely try their lemonade. It's freshly sqeezed and tastes great!"
Hazel C.,"San Leandro, CA",8/29/2016,4.0,"My sister made a reservation for 6 people for dinner here and though DC was my second home for a long time, this was only my first time here. Popular place! Make sure you have a reservation or you could be waiting a while! My sister, her fiancé and I had been craft brewery hopping all day, and snacking, so unfortunately I was not that hungry. Do come hungry as they serve you big portions here. I ended up taking most of my dinner home as the appetizers made me full real fast. For the table to share, we ordered the Skillet Corn Bread, Deviled Eggs and their Farm Bread with Brie, Onion Jam and Apple. I loved the Corn Bread the best. It was cakey, moist and yummy with the sea salt, honey and butter on top. Definitely a must get if you're dining here. Nothing particularly memorable about their Deviled Eggs and the Brie on Bread, but they were devoured by the group! I ordered the Chicken and Waffle dish which also came with Mac and Cheese. I chose the Mint Watermelon for my side. It was a lot of food! I tasted a bit of each item on my plate, but I took most of it home. The chicken was crunchy, not greasy and was moist and tasty. My sister ordered Spaghetti and she really liked hers too. My sister's fiancé's stepmom ordered the smaller cut of the Prime Rib and it was huge. The cut she was given had a lot of fat on it! Geez! Everyone loved their cocktails! The Cucumber Delight cocktail was very popular amongst our group. They ordered a couple of rounds of those. I had one of their Scratch Sodas, the Ginger one, and it was perfect. For dessert, we ordered just one thing, the Seasonal Fruit Crisp. Most of us were quite full at this point. That one desert was big enough though for 4 people. Founding Farmers is run by the North Dakota Farmers Union, so a majority of what's used in the restaurant comes from the 40,000 farmers that make up the Union. FF is one of DC's first Farm to Table restaurants. Next time you're in DC, check it out. And check out the water feature next door at the International Monetary Fund on your way to your car."
Lauren H.,"Mt Olive, NC",8/4/2017,5.0,We ate here back in march. We had to wait a super long time to get a table and we had to sit outside in the snow because the waiting area is so small but it was worth it. The waiter we had was so sweet and knew all about the menu. My husband loved his chicken and waffles. I got the meatloaf. It wasn't the best meatloaf I have ever eaten but the carrots were amazing. That was my favorite part of the meal. We would return!
Gretchen R.,"Needham, IN",3/15/2017,5.0,"Can I just put in a mattress and live here? Aesthetically pleasing, fun environment, and the biggest best menu. Holy cow. I want to book flights to DC just so I can eat more off the menu. Our waiter was so fun and was helpful in making suggestions. From appetizers, to drinks, to main course- this place is the bomb. Plus did I mention they have WARM COOKIES as a dessert option? #winning"
Koko A.,"Washington, DC",8/30/2017,5.0,"I love this place. Food tasted very good. Service was great also. There is a good selection. The wait was frustrating, however."
Beryl N.,"Springfield, VA","9/21/2016
            





Updated review",3.0,Still a 3 star experience for me and reconfirmed what I said a year ago. We had a 11 am brunch reservation and still had to wait a while when we came on time. Our friend picked Founding Farmers since it's within walking distance to the White House. They really score on their location since we walked by around 3 pm from our White House Tour and there's still people waiting to be seated. Food - I had the ranch steak and eggs and the steak was overcooked from what I requested. The best brunch item from our group was the crab benedict. The fresh crab meat to egg ratio was proportional and seasoned well. I do wish that their menu will state the difference between their chicken and waffle from breakfast and dinner. The sides are included in the menu description but the part of the chicken varies greatly. The breakfast chicken and waffle have fried chicken strips/tenders vs. the dinner version is a fried chicken leg and thigh.
