Joanna S.,"Western Addition, San Francisco, CA",6/11/2016,5.0,"Founding Farmers is a must-try in DC! I had the Yankee pot roast, which was a solid, hearty dish. It had a gigantic portion of pot roast atop a bed of mashed potatoes with a healthy portion of veggies. I also had a taste of the shrimp and grits, which was a cacophony of delicious flavor; the andouille sausage gives it a kick. The cocktails looked amazing, and will definitely come again to try them next time."
Heui Chan L.,"Philadelphia, PA",5/28/2017,4.0,"we got a bloody mary, corn bread, fish and chips, chicken and waffles, prime rib dip and farmer's platter. the corn bread is excellent, especially with bloody mary (ask for basil if you like it in the drink). everything was very good and they give you a ton of food. if you're visiting dc, it's highly recommended. make sure to make a reservation. they are busy all day."
Katy B.,"Rockville, MD",5/28/2017,5.0,"So good! It was packed for a Sunday brunch...make reservations or expect to wait a while - totally worth it! The beignets are amazing, mimosas wonderful and the food is sooo good! I had the veggie scramble and it won't disappoint, check them out!!"
Rhonda G.,"Los Angeles, CA","7/23/2017
            





Updated review",3.0,This is our third time at this restaurant. The first two times were wonderful and that's why we decided to return. This third time was not the charm. It was 8 o'clock and after museum hopping all day I so look forward to their delicious prime rib. That was the reason for making the reservation. I was told they had just run out. What???Through disappointment I ordered the 1/2 chicken. I was with two other people and all our meals came and the chicken was so dry it was not edible. I sent it back and I then ordered the spareribs. The spareribs came after the two other people finished their dinner so the spareribs became takeout and I never ate dinner. They did take the spareribs off the bill but I don't understand how the resturant can run out of prime rib when it's a very very popular dish at 8:30 on a Sunday night.
Jenni B.,"Washington, DC",11/27/2016,3.0,"Everyone raves about this place, but honestly I don't get it. It's good. It really is. But I think the hype is way over done. Also the service is seriously slow. Don't go starving because I promise you will be hangry by the time you are even getting drink orders in.In my few visits I've enjoyed some tasty burgers, enchiladas, flat breads and cocktails. Everything has been enjoyable, nothing has blown my mind. I recently visited with my parents because they thought this was on the show Bones or something and I had a mushroom Reuben and a sweet potato with pecans. It was a good sandwich but I hesitate to say it was delicious.The cocktails I really enjoy though and make this place a viable happy hour spot. I love that they have so many options with Rye and concoctions with egg whites. Not necessarily together, but I'd try anything once! I feel like I could easily make my way through their house specials list and never get bored. It would be a good place for a group because there is so much variety. With my parents I was able to get something boozy and dark, my mom ordered something fruity and bright and my dad wanted a local lager on tap. Everybody wins."
Laura W.,"Cedar Park, TX",3/1/2017,4.0,"Absolutely delicious and delightful experience.I recently moved to D.C. and this was pretty high on my list of places to try. Went for weekend brunch and, even with reservations, we had about a 10 minute wait to be seated. Slightly annoying, especially since the front area was extremely crowded, but they were obviously busy. We had two breakfast plates and split the lobster mac and cheese, not the healthiest idea in retrospect but it was so worth it. I only wish we could have finished everything. I will definitely be purchasing their cookbook to try and recreate their dishes at home."
Helen T.,"Richmond, VA",5/12/2016,2.0,"The service here wasn't too great. My boyfriend and I dropped in for lunch, we were immediately seated without a reservation, which was very nice considering they were pretty busy with the lunch rush. We were seated at a shared long table resembling a picnic table in the middle of the restaurants. My boyfriend definitely didn't like that as the stools we sat on were both tall, uncomfortable and not to mention often bumped into due to being located in the middle of the restaurant (high traffic area). I ordered the chicken pot pie and he ordered the roast turkey sandwich with a side of Mac and cheese. Presentation was great, we both really liked his Mac and cheese (I snuck in a couple of bites!) and agreed that my chicken pot pie, with the biscuit in the center rather than in a traditional pie format was very tasty, albeit somewhat cold when served. The food overall left something to be desired. Our wait staff seemed impatient with us. When my friend inquired about the drinks our waitress informed us that ""they didn't sell sodas here"" rather only in house made sodas in an extremely rude manner. Okay, that's fine, I understand you must be busy with all these tables and the lunch rush but the snappy attitude was ridiculous. She seemed to realize how off putting it was because she was agreeable the rest of the meal. However we noticed that she wasn't very diligent in coming over to ask if we needed refills or if we needed anything. Not very good wait staff.Decor was nice overall, the bar area seemed nice, we probably won't be returning though."
Fiorella M.,"Miami, FL",5/27/2016,5.0,"Literally the best restaurant I've been to in America. GREAT food, GREAT service, and my favorite part was the prices!!! I honestly felt like I paid way less for the service and yumminess I got to experience. Nathan was our server and he gave great recommendations."
Josh N.,"San Dimas, CA",2/4/2017,5.0,"There's a reason this place has over 8k reviews. First off the bartender Tommy was very helpful in suggesting things on the menu. I ended up with the Pork chop, maple Brussel sprouts, and sweet potato.Our time here was not perfect however a sandwich we ordered came with onions that we did not want and we also ordered an appetizer that never came.  All of this is forgiven when I tasted the food. This is mind blowing searched your whole life to taste kind of food. I don't live here but would travel here just to have the meal I just ate."
Felicia W.,"Manhattan, NY",11/17/2016,5.0,"One of the best restaurants in DC. make sure you get the cornbread if you go, it is so good and I am still craving it. Another popular appetizer is the kettle corn. They have a variety of cocktails (I got the constitution). GO. you won't regret it."
Geo G.,"Washington, DC",6/20/2017,5.0,"If you want a table, make a reservation.  But we have always been able to sit at the bar. Been there now several times, my new favorite place .Great appetizers,are the dumplings"
Martha W.,"Washington, DC",10/23/2016,3.0,"3.5 stars. I should have ordered the eggs instead of the stuffed French toast. Simply too sweet. I was there with a group of seven and everyone was basically pleased with the food (eggs, waffles, coffee, juice) and service. I felt a little too old for the young crowd. Great people-watching. Very lively atmosphere. Will go back when my friends have college-aged young-ins with them!"
Reginald B.,"Lakeland, FL","6/7/2017
            





Updated review",5.0,"I was at Founding Farmers 2 years ago and I said I would try them again.  Every time I see grits on an entrée, I frown up.  I do like grits but I just cant see eating them for lunch or dinner.  Ok, with that being said, the shrimp, grits, and sausage is a must!!!!!!..  If they could ship that to me in Florida I would buy it..  I was blown away by the flavor.  Hats off to the chefs that made this happen.  The food was hot and fresh.  Next time I'm in DC, the grits is definitely on my list!!!!!!!!!"
Tara B.,"North Charleston, SC",5/16/2017,5.0,"We enjoyed our brunch here while visiting Washington DC. Two things I would like to point out: 1.) reservations HIGHLY recommended and 2.) if you want a mimosa or Bloody Mary with your brunch, make that reservation after 10am.  We knew about the reservation needed due to friends who had been there. We were very happy to have made it since the place was very busy. However, we had made our reservation for 9am. I wish the website had mentioned no alcohol before 10am, and we would have made our reservation for later. The hostess told us we could ""go over to the bar and enjoy some orange juice if we liked.""  I thought that was ""orange juice--wink, wink"" code for mimosas. Lol. So we ordered 2 mimosas and the bar tender looked at us like we each had 2 heads and replied ""we can't serve alcohol until after 10:00am.""  Ok then. I had no clue since I come from a city where the night shift nurses go out for mimosas after work at 7:30am on Sunday mornings. So anyway, the food was great. I loved my chicken and waffles that I had. We also had fantastic service. Location is nice too. We walked to the White House from there after we ate."
Good A.,"Camarillo, CA","5/13/2016
            





Updated review",1.0,"Was 3 Stars, the last time I was here, this place has gone downhill, the hostesses at the front waiting area are over worked and have a very poor attitude.  I was quoted 30 mins wait time, the wait ended up being over 1.5 hrs.  If you need to come here, plan on waiting for a very long time.We kept getting ""come back in 20 mins"" excuses, well that 20 mins became 1 1/2 hours, and on top of that, we had to share the table with another group.To add more insult to injury, the silverware was dirty, food was stuck on the fork still..."
Heidi H.,"San Jose, CA",6/3/2016,3.0,"I had the shrimp bucatini and it was good. Their homemade pasta was done right, the sauce was tasty not heavy and shrimp was cooked perfectly.. We also had the deviled eggs and those were ok a lil on the salty side. My husband had the hot dog trio and said it was good. Overall this restaurant is ok."
Hanisha A.,"Inglewood, CA",12/29/2016,5.0,"I let me server choose my dinner and it was the best decision. Started with blue cheese stuffed bacon wrapped dates that were like grown folk candy in my mouth, sweet and savory. Woke my tastes buds up and readied me for pot roast...tender beef and fresh vegetables on top of mashed potatoes! Slap yo mama! Washed it down with a spicy and delicious Clemetime cocktail (I wanted to lick all the sugar off the glass). Like all the other reviews...fantastic food and great service. Reservations are a MUST unless you don't mind an hour wait."
DJ M.,"Williamsburg, VA",8/18/2017,4.0,"What a great restaurant, the whirly pop- corn was fantastic, finely done steaks, perfect prime rib and a large selection of libations."
S S.,"Los Angeles, CA",6/5/2017,4.0,Nice place. Nice server  I am giving 4stars to the meal because there was only half an strawberry in my fruit cup! The sauce on egg benedict was not enough and the meal was not warm.
Ellen S.,"Bowie, MD",5/14/2017,4.0,Came here for brunch! We each ordered something different and everything was superb. Highly recommend coming on the weekend!
Lily C.,"Islip, NY",12/12/2016,4.0,"The beignets were divine. We got there around 9 and it was already packed. A good sign. You don't get over 8K 4 star + reviews on Yelp! and expect differently. But the reason why it got all those great reviews is because the food was excellent. My eggs were cooked perfectly. I'm really fussy about my eggs too. I like them medium well. I also had the carrot cake pancakes. They were very very good, not the best I've had but a close second. The highlight was definitely the beignets though and out waiter. I wish I remembered his name for this review. He was from California. That much I remembered. Anyway, he was great. Funny and really great even though it was crazy crowded. It was a Sunday. Anyway, I would absolutely go back again."
Debbie B.,"Brandon, FL",6/4/2017,4.0,There was a very long line as would be expected on a Sunday morning but we were able to jump in a bar seat pretty quickly. The strawberry cream French toast was amazing. The service was also super!
Yvan G.,"Ortonville, MI",1/27/2017,5.0,"Had probably the best prime rib of my life! It was a sea salt encrusted prime rib with a side of maple pecan encrusted sweet potato and succotash. For starters we had one of their sweet breads topped with prosciutto, fig, olives and balsamic. That was a very tasty combo. Had a five star saison ale that just topped off the entire meal. It was delicious, quick, and quite enjoyable!"
Laine C.,"Washington, DC",8/7/2017,4.0,"This place is super popular and has a great brunch vibe. We were seated upstairs which I felt had a significantly better ambiance than downstairs which was incredibly noisy. We enjoyed the crab corn dip as well as the fried green tomatoes. The steak and (3) eggs were pretty good, too! Portions were on the larger side, which was nice given that's not usually been my experience in the DC brunch scene.  Service was excellent and I'd definitely come back!"
Tony M.,"Washington, DC",3/19/2017,3.0,"Located in the IMF HQ #2 Building, they do a very busy Business lunch business, so busy that if you're late 15 minutes past your reservation, it is cancelled or revert to ""walk in"" status which is about 30-45 minutes.They boast ""farmer"" ingredients, and quite frankly, the menu was not memorable that I could recite much from it.  Thus, it is the ""wholesomeness"" of ingredients rather than the dishes,For that wholesomeness, it is expensive."
David T.,"Palm Bay, FL",11/3/2016,4.0,"The washington post gave this place zero stars, so I had to try it out. I came in for a late lunch on a Tuesday.I was seated promptly, the service was good, the food was good and the place was clean. Simple as that. The prices are not great - $16 for meatloaf with potatoes and green beans BUT GUESS WHAT? Any place a 15 minute walk from the White House isn't going to be on the cheap side. I would go back. I wouldn't wait 3 hours for a table but it's a nice place to have a meal."
Christine L.,"Ann Arbor, MI",6/3/2017,5.0,I can understand the popularity of this restaurant. The host was really friendly and the staff were nice and made sure if food was good. I ordered shrimp and grits and wow it was heavenly delicious. The cornbread was decent too. My company ordered a pot roast dish and he said he loved it too. I definitely would go there often!
John W.,"Arlington, VA",5/22/2017,5.0,"My favorite restaurant in DC, amazing every visit, big portions, great food.  I usually have the braised ribs, never dossapoint"
Mekdela T.,"Washington, DC",5/29/2016,3.0,"I've been dying to try founding farmers and finally got a reservation for lunch time on a Saturday. Although I wanted brunch, I figured lunch would do because the chicken and waffles is what everyone talks about and it's on the lunch menu. The restaurant is large, and we were sat 10 minutes before our reservation time. The service was great, I enjoyed our server. For the appetizer, we ordered the cornbread....AMAZING. If I come back, it's to try brunch, and get the cornbread again! The skillet cornbread was 5 dollars and I loved it! The sea salt honey butter sounded scary at first, but went so well with the cornbread, GET IT.For lunch, I got the chicken and waffles with Mac and cheese and red potatoes. Honestly, the food was pretty average. I wish my chicken could have been seasoned a little more, and the waffles looked thick, but were actually really thin. I'd rather have fluffy waffles. My boyfriend got the shrimp and grits. Before we ordered, the server was nice enough to let us know that the shrimp and grits are more soupy than what we would expect. We ordered the dish anyways, keep in mind, if you want extra grits...6 dollars. The shrimp and grits were actually pretty tasty, we enjoyed the dish. Overall, food was average, service was great. I'll be back for brunch!"
Rob W.,"New York, NY",11/8/2016,5.0,So many choices of delicious food. Casual but upscale enough to wear a suit or tennis shoes. Make a reservation if party of more than four. I was a walkin with two others in a very busy night at 6pm. 15 minute wait time. Staff is friendly and knowledgeable.
Justin W.,"State College, PA","7/29/2017
            





Updated review",4.0,"The food was good. I ordered the bread with figs, balsamic, cheese one of of the best things I have eaten. The shrimp and grits was ok but the other food at our table came out great. Slower service but very busy. Worth a try!"
Mangirish W.,"Auburn Hills, MI",3/17/2017,5.0,By far one of the best meals I have had in the US. Service was excellent. Food was served quickly. Only thing is you have to wait but it is definitely worth it. Thank you for making my trip to DC memorable
Stephanie R.,"Redmond, WA",6/16/2017,5.0,"Just ate brunch there. So good! They were right on time (we were seated at 2pm, our reservation was at 2pm). Despite how busy they were, we felt like we were eating at a very small personal restaurant. I highly recommend the cornbread skillet. Also one of the best bloody Mary's I've had, and I consider myself a bit of a Bloody Mary connoisseur. Very friendly waitstaff. Everything cooked and made onsite, and you can taste the freshness. Will definitely go back."
Khushbu M.,"Tampa, FL",1/22/2017,5.0,"Oh my lord, don't even get me started. I started craving some more pasta as I was walking out the door. I got the butternut squash ravioli, and the cranberry burger. DELICIOUS. Seriously some of the most fresh and best tasting food I've ever had. Service was great, and the food was insanely fresh. Also, their freshly made sodas are amazing! We got the ginger soda and the hard orange. The service was also wonderful. The 5 warm cookie desert topped everything off even more :) Definitely on the pricey end, but well worth the splurge."
April M.,"Washington, DC",1/3/2017,5.0,"I love this place, especially breakfast.  The food is amazing and the service is great.  Although it is super crowded on Sundays, I like the ambience and the feel of DC brunch so it doesn't really bother me... oh and the beignets, oh the beignets...  Visiting this restaurant is a definite MUST!"
Leslie T.,"Washington, DC",5/26/2016,5.0,"Honest, genuine, and delicious are what comes to mind when I think about FF.   It's difficult for a restaurant this popular and that can hold this many people to consistently be spot on, but somehow, they manage.  I've been here twice.  The first was for brunch.  We came with a large group of millennials (surprise, surprise) and all of us were in breakfast food heaven.  The stuffed french toast was incredible.  Definitely get that.  The second time, we brought my dad, who was visiting from out of town.  We started with the kettle-corn and it was amazing!  Hot, huge kernels, not too sweet, just right for munching before dinner.  Then we had the goat cheese ravioli (my husband loved the thin pasta casing innovation and the sweet potato sauce), the mushroom sausage gnocchi (I think this was the group favorite-savory, lots of warm spices, evenly balanced sauce.  Get this, you won't regret it!) and the chicken and waffles (fried without being greasy, delicious mac & cheese side).I love that its farm to table without braking the bank.  It's very reasonably priced and they treat everyone like friends.  Come here with high expectations...they will be met!"
Anteese M.,"Capitol Heights, MD",11/10/2016,5.0,"This was my first time here and start to finish the experience was exceptional! It wasn't crowded, we were seated right away. We had a huge stroller with us and they accommodated perfectly! My hubby had the chicken pot pie he LOVED IT! I had the chicken bolognese it was good a little oily, but that honestly didn't bother me. Oh! How can I forget the black pepper garlic wings SINFUL! John wasn't supposed to be our original server, but I am sure glad he was! He was completely attentive the whole time... his service was phenomenal... our bill was $68 I tipped him $25 he even came back and was like did you mean to tip me that much on purpose and I was like yeah! Your service was damn near immaculate! I truly enjoyed myself!! I will DEFINITELY be back!"
Carol C.,"San Diego, CA",10/27/2015,4.0,"Came here at the recommendation of a local and I'm happy to have trekked over from the Vietnam Memorial. The walk led me past buildings and neighborhoods, most tourists don't traipse though, past the Federal Building, the IMF and a portion of George Washington University.The food and drink were on point. I had the breakfast Chicken & Waffles which came with scrambled eggs, white sauce & syrup. My cappuccino was excellent. I look forward to sampling more of the menu next time in DC. The restaurant seemed to be filled with regulars and for good reason. I recommend making reservations as it appeared difficult to accommodate me and I was a small party of 1!"
Michelle A.,"Queens, NY",11/24/2015,5.0,"I really enjoyed this place. I came here with my family while visiting D.C. for the weekend. We couldn't fit it in for dinner, so had to settle for breakfast even though we aren't breakfast people. We arrived shortly after they opened on a Sunday. I made reservations, but it wasn't necessary since it was pretty empty. It's not a large restaurant, so I can see it getting packed during busy times. Our server was really sweet and patient. We couldn't decide what to have, so she gave us time. We ended up getting the chicken and waffles, strawberries and cream French toast, beef pastrami hash and blueberry butter pancakes. We told our waitress we heard great things about the fried green tomatoes (which normally aren't served at breakfast). She asked the chef if it were ok to make them for us and they did! Everything was delicious, but the stars were the chicken and waffles and the fried green tomatoes. The chicken and waffles were different because they were served with gravy. It made the dish savory, yet not heavy. The fried green tomatoes were perfectly crisp and not greasy. Thanks Yelpers for the heads up! I want to come back to try their dinner items."
Amy L.,"Pawtucket, RI",12/5/2016,2.0,"I'm hoping I just came on a bad day. I went this morning for breakfast and bellied up to the bar since I was flying solo. The bartender was initially attentive and put my order in quickly. My food came out at the speed of light. I ordered the veggie scrambler which was mediocre. I primarily eat a plant based diet so was pumped to see that as an option, without having to make my own veggie delight! The mix of veggies was just weird. Somewhere along the way I got one random bite of cilantro. The veggies were all cooked to varying done-ness. When I asked for orange juice, I was told they were out of it. Who runs out of oj on a Monday morning?!Someone from the kitchen served me my plate. The presentation was lack luster; a mush of egg whites and veggies smooshed on a plate. My bartender never asked how my meal was or if I needed anything...which I did. I needed salt and ketchup. I also grabbed myself a pitcher of water since there were no refills in sight. While eating, there was some sort of restaurant drama with a begrudging customer and that interfered with the rest of the dining experience. Whatever had happened seemed to have thrown the staff off. Hats off to the bartender for providing me with a glass of oj on the house when the oj fairy arrived at the restaurant."
Ashley W.,"Washington, DC",7/22/2017,1.0,"Please don't go here. Service was slow, waitress only showed up to take the order and drop off the check.  The place was also a bit louder than comfortable for conversation. My wife had prime rib which was salty and overpriced. I ordered the chicken pot pie which should have been advertised as chicken soup covered with a pie crust. It was also extremely salty.  Overall for the two entrees we ordered we paid close to $50, but would have been better off getting prime rib and a Sara Lee frozen pot pie from Harris Teeter."
Jenny R.,"Theater District, Manhattan, NY",6/14/2017,5.0,My daughters have food allergies and our waitress and the chef worked together to cook them a meal that they both loved. I am extremely thankful that they were so attentive and accommodating. I highly recommend this delicious restaurant.
Sarah H.,"Cambridge, MA",5/4/2017,2.0,"I keep coming here because the chicken and waffles they serve at brunch are spectacular, but the service is bad and seems to be getting worse.Over the years, I have spent hours of my life waiting to be seated here; usually you have to wait at least 10-15 minutes, even when you have a reservation. If you arrive a couple of minutes late, they will have already given your table away. If your party is waiting on one person, they refuse to seat you even when there are literally dozens of empty tables."
Kelsey W.,"Sugar Land, TX",5/31/2017,3.0,"Yummy food - we visited while we were in DC for a weekend getaway. The food is good, but pricey. And the atmosphere was a bit more crowded and loud than I expected for the price. They tables are really close together so it felt like we were having dinner with the neighboring table..."
